{
  "id": "12345678-1234-5678-1234-567812345678",
  "actor":{
    "account": {
        "homePage": "http://www.example.com",
        "name": "1625378"
    }
  },
  "verb":{
    "id":"http://adlnet.gov/expapi/verbs/created",
    "display":{
       "en-US":"created"
    }
  },
  "object":{
    "id":"http://example.adlnet.gov/xapi/example/activity"
  }
}

